[
  {
    "sessionId": "daily-routines-and-habits",
    "sessionTitle": "Daily Routines and Habits",
    "eventType": "speaking-club",
    "language": "English",
    "level": "A2",
    "exportDate": "2025-05-10",
    "vocabulary": [
      {
        "id": "en:commute:noun",
        "term": "commute",
        "pos": "noun",
        "definition": "the regular journey to and from work or school",
        "translation": "",
        "example": "My daily commute takes thirty minutes by bus.",
        "primary_theme": "everyday-life",
        "sub_theme": "routines",
        "tags": [
          "everyday-life",
          "routines"
        ],
        "level": "A2"
      },
      {
        "id": "en:routine:noun",
        "term": "routine",
        "pos": "noun",
        "definition": "a sequence of actions regularly followed",
        "translation": "",
        "example": "Having a healthy morning routine helps me start the day well.",
        "primary_theme": "everyday-life",
        "sub_theme": "routines",
        "tags": [
          "everyday-life",
          "routines"
        ],
        "level": "A2"
      }
    ]
  },
  {
    "sessionId": "ordering-food-and-dining-out",
    "sessionTitle": "Ordering Food and Dining Out",
    "eventType": "speaking-club",
    "language": "English",
    "level": "A2",
    "exportDate": "2025-05-17",
    "vocabulary": [
      {
        "id": "en:appetizer:noun",
        "term": "appetizer",
        "pos": "noun",
        "definition": "a small dish served before the main course",
        "translation": "",
        "example": "We ordered garlic bread as an appetizer.",
        "primary_theme": "everyday-life",
        "sub_theme": "dining-food",
        "tags": [
          "everyday-life",
          "dining-food"
        ],
        "level": "A2"
      },
      {
        "id": "en:bill:noun",
        "term": "bill",
        "pos": "noun",
        "definition": "a printed statement of the money owed for goods or services",
        "translation": "",
        "example": "Could we please have the bill when you are ready?",
        "primary_theme": "everyday-life",
        "sub_theme": "dining-food",
        "tags": [
          "everyday-life",
          "dining-food"
        ],
        "level": "A2"
      }
    ]
  },
  {
    "sessionId": "debatable-relatable-4-day-work-week",
    "sessionTitle": "The 4-Day Work Week: Productivity vs. Tradition",
    "eventType": "speaking-club",
    "language": "🇬🇧 🇫🇷 🇪🇸 🇮🇹 🇷🇺",
    "level": "Intermediate (B1)",
    "exportDate": "20 August 2025",
    "vocabulary": [
      {
        "id": "en:burnout:noun",
        "term": "Burnout",
        "pos": "noun",
        "definition": "physical or mental collapse caused by overwork or stress.",
        "translation": "",
        "example": "Many employees are suffering from burnout due to long hours.",
        "primary_theme": "everyday-life",
        "sub_theme": "routines",
        "tags": [
          "everyday-life",
          "routines"
        ],
        "level": "B1"
      }
    ]
  },
  {
    "sessionId": "debatable-relatable-ai-and-art",
    "sessionTitle": "AI and Art: Can machines be truly creative?",
    "eventType": "speaking-club",
    "language": "🇬🇧 🇫🇷",
    "level": "Advanced (C1)",
    "exportDate": "22 June 2025",
    "vocabulary": [
      {
        "id": "en:originality:noun",
        "term": "Originality",
        "pos": "noun",
        "definition": "the ability to think independently and creatively.",
        "translation": "",
        "example": "The designer's work is known for its originality.",
        "primary_theme": "everyday-life",
        "sub_theme": "routines",
        "tags": [
          "everyday-life",
          "routines"
        ],
        "level": "B1"
      }
    ]
  },
  {
    "sessionId": "debatable-relatable-assisted-dying",
    "sessionTitle": "Assisted Dying: Yes or No",
    "eventType": "speaking-club",
    "language": "🇬🇧 🇫🇷 🇪🇸 🇮🇹 🇷🇺",
    "level": "Advanced (C1)",
    "exportDate": "16 July 2026",
    "vocabulary": [
      {
        "id": "en:autonomy:adjective",
        "term": "Autonomy",
        "pos": "adjective",
        "definition": "the right of self-government or independence ≠ the act of bringing under complete control.",
        "translation": "",
        "example": "The artificial intelligence fought for complete autonomy, rejecting any form of human subjugation.",
        "primary_theme": "everyday-life",
        "sub_theme": "routines",
        "tags": [
          "everyday-life",
          "routines"
        ],
        "level": "B1"
      }
    ]
  },
  {
    "sessionId": "debatable-relatable-chatting-with-ai-vs-human-elementary",
    "sessionTitle": "Chatting with an AI vs Chatting with a Human (A2)",
    "eventType": "speaking-club",
    "language": "🇬🇧 English",
    "level": "Elementary (A2)",
    "exportDate": "15 June 2026",
    "vocabulary": [
      {
        "id": "en:chatbot:adjective",
        "term": "Chatbot",
        "pos": "adjective",
        "definition": "a computer program designed to simulate conversation with human users.",
        "translation": "",
        "example": "The chatbot answered my questions instantly.",
        "primary_theme": "everyday-life",
        "sub_theme": "routines",
        "tags": [
          "everyday-life",
          "routines"
        ],
        "level": "B1"
      }
    ]
  },
  {
    "sessionId": "debatable-relatable-chatting-with-ai-vs-human-intermediate",
    "sessionTitle": "Chatting with an AI vs Chatting with a Human (B1-B2)",
    "eventType": "speaking-club",
    "language": "🇬🇧 English",
    "level": "Intermediate (B1/B2)",
    "exportDate": "15 June 2026",
    "vocabulary": [
      {
        "id": "en:algorithm:adjective",
        "term": "Algorithm",
        "pos": "adjective",
        "definition": "a process or set of rules to be followed in calculations.",
        "translation": "",
        "example": "The algorithm predicts what you want to read next.",
        "primary_theme": "everyday-life",
        "sub_theme": "routines",
        "tags": [
          "everyday-life",
          "routines"
        ],
        "level": "B1"
      }
    ]
  },
  {
    "sessionId": "debatable-relatable-homework-ban",
    "sessionTitle": "Homework should be banned",
    "eventType": "speaking-club",
    "language": "🇬🇧 🇫🇷 🇪🇸 🇮🇹 🇷🇺",
    "level": "Intermediate (B1)",
    "exportDate": "20 July 2025",
    "vocabulary": [
      {
        "id": "en:mandatory:adjective",
        "term": "Mandatory",
        "pos": "adjective",
        "definition": "required by law or rules ≠ done, given, or acting of one's own free will.",
        "translation": "",
        "example": "School attendance is mandatory, but participating in extracurricular sports is completely voluntary.",
        "primary_theme": "everyday-life",
        "sub_theme": "routines",
        "tags": [
          "everyday-life",
          "routines"
        ],
        "level": "B1"
      }
    ]
  },
  {
    "sessionId": "debatable-relatable-human-cloning-intermediate",
    "sessionTitle": "Human Cloning",
    "eventType": "speaking-club",
    "language": "🇬🇧 English",
    "level": "Intermediate (B1)",
    "exportDate": "10 July 2026",
    "vocabulary": [
      {
        "id": "en:cloning:noun",
        "term": "Cloning",
        "pos": "noun",
        "definition": "the process of producing genetically identical copies of an organism.",
        "translation": "",
        "example": "Therapeutic cloning could help us cure various degenerative diseases.",
        "primary_theme": "everyday-life",
        "sub_theme": "routines",
        "tags": [
          "everyday-life",
          "routines"
        ],
        "level": "B1"
      }
    ]
  },
  {
    "sessionId": "debatable-relatable-human-cloning-upper-intermediate",
    "sessionTitle": "Human Cloning",
    "eventType": "speaking-club",
    "language": "🇬🇧 English",
    "level": "Upper-Intermediate (B2)",
    "exportDate": "10 July 2026",
    "vocabulary": [
      {
        "id": "en:cloning:noun",
        "term": "Cloning",
        "pos": "noun",
        "definition": "the scientific replication of biological entities to create genetically identical individuals.",
        "translation": "",
        "example": "Therapeutic cloning allows researchers to grow personalized replacement tissues.",
        "primary_theme": "everyday-life",
        "sub_theme": "routines",
        "tags": [
          "everyday-life",
          "routines"
        ],
        "level": "B1"
      }
    ]
  },
  {
    "sessionId": "debatable-relatable-living-with-family-vs-living-alone-elementary",
    "sessionTitle": "Living with Family vs Living Alone (A2)",
    "eventType": "speaking-club",
    "language": "🇬🇧 English",
    "level": "Elementary (A2)",
    "exportDate": "21 August 2026",
    "vocabulary": [
      {
        "id": "en:alone:adjective",
        "term": "Alone",
        "pos": "adjective",
        "definition": "without other people around.",
        "translation": "",
        "example": "She lives alone in a small apartment.",
        "primary_theme": "everyday-life",
        "sub_theme": "routines",
        "tags": [
          "everyday-life",
          "routines"
        ],
        "level": "B1"
      }
    ]
  },
  {
    "sessionId": "debatable-relatable-living-with-family-vs-living-alone-intermediate",
    "sessionTitle": "Living with Family vs Living Alone (B1)",
    "eventType": "speaking-club",
    "language": "🇬🇧 English",
    "level": "Intermediate (B1)",
    "exportDate": "22 August 2026",
    "vocabulary": [
      {
        "id": "en:independence:adjective",
        "term": "Independence",
        "pos": "adjective",
        "definition": "freedom from outside control or support.",
        "translation": "",
        "example": "Living alone fosters rapid personal independence.",
        "primary_theme": "everyday-life",
        "sub_theme": "routines",
        "tags": [
          "everyday-life",